THAI	ROMANIZATION	DEFINITION	NOTES	ROOTS
ไม่	mâi	not; no	Main negation word placed before verbs/adjectives (ไม่ไป = not go, ไม่ดี = not good).	
อีก	ìik	more; again; another	“More/another/again”; often used before a classifier or noun (อีกหนึ่งอัน = one more piece).	
อย่าง	yàang	kind; type; way	Classifier for “kind/type” and also “in this way” (แบบนี้อย่างไร = how like this?).	
อัน	an	classifier for small things	Classifier for small countable objects (หนึ่งอัน, สองอัน).	
หลาย	lăai	many; several	Placed before a classifier or noun (หลายคน, หลายอย่าง).	
บาง	baang	some; certain	“Some / certain…” (บางคน, บางอย่าง); not used alone.	
ของ	khǎawng	thing; belongings; of	Means “of / belonging to” and “things, stuff” (ของกิน = things to eat).	
หน่อย	nòi	a little; a bit (please)	Softens requests (ช่วยด้วยหน่อย, รอแป๊บหนึ่งหน่อย); “a little bit.”	
นิดหน่อย	nít nòi	a little bit; a few	Common phrase for “a little / a bit / a few.”	นิด, หน่อย
อีกนิดหน่อย	ìik nít nòi	a little bit more	Used for asking/mentioning a bit more of something (กินอีกนิดหน่อย = eat a little bit more).	อีก, นิด, หน่อย
ไม่กี่	mâi gìi	not many; a few	Used before classifier/noun: “a few / not many” (ไม่กี่คน = a few people).	ไม่, กี่
อีกไม่กี่อย่าง	ìik mâi gìi yàang	just a few more things	Often about items to do/buy; literally “more not-many kinds/things.”	อีก, ไม่, กี่, อย่าง
ของไม่กี่อย่าง	khǎawng mâi gìi yàang	a few things (some stuff)	Literally “things not many kinds”; natural for “just a few things.”	ของ, ไม่, กี่, อย่าง
มีอีกไหม	mii ìik mái	is there more?; any more?	Used when asking if there is more of something left (food, items, tasks).	มี, อีก, ไหม
แค่นิดหน่อย	khâe nít nòi	just a little; only a bit	Downplays quantity/degree; “only a little” (e.g. แค่นิดหน่อยเอง).	แค่, นิด, หน่อย
แค่นี้ก็พอ	khâe níi gôr phor	this is enough; just this is fine	Literally “only this is enough”; used to say you don’t need more.	แค่, นี้, ก็, พอ
นิด	nít	a little; a bit	Base word in นิดหน่อย “a little bit”; means a small amount.	
มี	mii	have; there is/are	Core verb “to have / to exist”; used in มีอีกไหม “is there more?”.	
แค่	khâe	only; just	Limits amount/degree: “only / just …”; used in แค่นิดหน่อย, แค่นี้ก็พอ.	
นี้	níi	this	Demonstrative “this”; used in แค่นี้ก็พอ “just this is enough”.	
พอ	phor	enough; sufficient	Means “to be enough / sufficient,” both quantity and degree.	
นั่น	nân	that (over there)	Distal demonstrative paired with นี้ (this); often points to something a bit away from speaker.	
ทาง	thaang	way; route; path	Can mean physical path/road, “way/method,” or “direction” depending on context.	
สิ่ง	sìng	thing; object; matter	Used for “thing(s)” in many compounds (สิ่งของ, สิ่งที่…, สิ่งแวดล้อม, etc.).	